,0
0,"The KOSDAQ market headquarters said that Il G&ST had not submitted financial statements proving that it was out of the abnormal state of capital erosion until today, and told them to be careful about investment. Due to losses, it was designated as a management item last month. Accordingly, the company had to submit financial statements and auditor's audit report including details on whether the capital erosion was resolved by the deadline for submitting the semi-annual report for the business year. It has been announced that ST's trading will be suspended. If G&ST does not submit a semi-annual audit report by the next day, or if the capital erosion rate is still higher than , the delisting process may proceed if it receives an audit opinion such as rejection of an unfavorable opinion and limitation due to the limitation of the scope of the audit. 10,000 won Land The statue of President Kim Dae-jung turned upside down for the first time in a year A statue of President Kim Dae-jung turned upside down The shock of killing his wife and his three sons per capita income of billions of won Do not redistribute"
1,"G&ST has been on a sharp rise for the fourth day as it emerged from the crisis of delisting. Stock trading has been suspended since the last day because of the risk of delisting if the capital erosion rate exceeds , even in the first half of this year. After that, the price soared to the upper limit for the third day until the previous day, and the trend continues today. More than one person opened the warehouse door and ran in a frenzy. Hanging from the windshield of a car, Super Cop ate Viagra while watching a lewd video. In the end, next year’s revision elementary school math is the reason why he went back to a domestic car after riding an imported car Go to the world eyes Global media World Daily."
2,"Procurement of a total of 100 million won including bequest society | This article was published in the monthly capital market media Money Today. G&ST was designated as an investment alert due to its weak profitability and capital erosion. The reality of G&ST is that it is impossible to operate a normal company without external financing as it has recorded an operating loss every year for consecutive years since 2008. Although sales increased by more than 100 million won, operating loss only decreased by 100 million won. This is because cost of sales and SG&A expenses increased in proportion to sales. Financial expenses also amounted to billions of won, resulting in a net loss of billions of won. It has a structure in which expenses increase as income increases. Even looking at the results of this quarter, a turnaround is not expected to be easy. Sales decreased to 100 million won, less than half of the same period of the previous year, and operating loss was similar to the previous year by 100 million won. As the net loss continued, the loss also increased to 100 million won. As of the end of the year, G&ST's capital erosion rate reached . Companies with a capital erosion rate exceeding , are also designated as managed items according to the exchange regulations that require them to be designated as managed items. A regulation that allows companies to make losses for consecutive years after the year of 2008 may also affect whether they are listed on the delisting substantive examination. entered the market. In its first year of listing, it recorded sales of KRW 100 million and operating profit of KRW 100 million. The operating profit margin reached . Even at this time, color CRTs were in the spotlight because of their superior price competitiveness compared to mine. The operating profit margin of G&ST declined sharply over the years. In the year following the listing, sales increased to KRW 100 million, but the operating profit margin decreased to . due to increased cost of sales and SG&A expenses. In the year when sales decreased to 100 million won, it recorded an operating profit of just over 100 million won. This is because, as the market grew rapidly, it replaced color CRT. G&ST turned to a loss-making company for the last time after recording an operating surplus for the year. G&ST's loss streak, which started in 2011, has continued for the past year. From this point on, G&ST started to live on through external financing. Over the years, G&ST has conducted a total number of rights offerings, including shareholder allocation and general public offering for allotment to third parties, and issued convertible bonds one after the other with warrants. The funds raised through the capital increase alone amounted to KRW 100 million, and the funds raised through W and more than KRW 100 million. G&ST continued to receive external blood transfusions, but was unable to use it as a live ammunition to advance into new businesses. This is because the amount of procurement was at a level that was urgent to make up for the loss with as little as 100 million won when the size of the procurement was large. For a turnaround, G&ST entered the backlight power supply business and home shopping online shopping mall business one after another. However, he was hesitant to make a large-scale investment and continued a vicious cycle of failure because he was in a hurry to follow market trends. This is when the lighting business was just starting to get into the limelight. Lumisys, which was expected to play a key role, posted a net loss of nearly 100 million won a year. The slowdown in the construction industry played a decisive role. Kim Jeom-deok, who sells the fastest if sold second-hand, is the shameless Kim Jeom-deok after killing an elementary school student in Tongyeong Why did he win five stars in the Supreme Court Lawsuit for a long-lived bed? A new image appeared and even the department store smiles. Unauthorized reproduction and redistribution of News Money Today is prohibited."
3,"Seoul News reporter Jang Jin-bok, G&ST, decided to reduce the number of common stocks by merging the Japanese common stock. The reason for the reduction is to improve the financial structure. After the reduction, the capital will decrease from about 100 million won to about 100 million won, and the common stock will decrease from 10,000 shares to 10,000 shares, respectively. Previously, G&ST was designated as a management item for reasons such as continuous operating losses and capital erosion rate in recent business years. As of the end of last year, GMS' capital erosion rate ..c. stock price is riding a roller coaster. In the past, the stock price of G&ST, which announced the news of potatoes after the close of the market on that day, will decline again at the same time as the start of the market is growing. G&ST A stock discussion was held with officials about the reason for the decision to reduce the cap, and the direction of the stock price. The reason for deciding on potatoes. Earlier, he said that he was considering a capital increase or a potato. To improve the financial structure. G&ST announced on the 1st of last month that it is considering a capital increase or reduction in financial structure to improve its financial structure. Why did you choose potatoes over bequests? In other words, to improve the financial structure. Capital erosion is at stake, but potatoes were not cut to solve capital erosion. It was simply reduced in order to improve the financial structure. Today, the stock price has risen to its upper limit. I don't know why. There is a high risk of a share price decline in the coming days. The potato news last month said it was under review. Potatoes were able to come out. If you do not anticipate the market reaction. After the news of the potato came out, there was no phone call. The reason for the large fluctuations. I don't know why. You never know who's buying or selling. Literally, the commonly talked about institutions go up when attached. Jang doesn't know how the company works. Other plans to improve performance. We are paying a lot of attention because we have to make operating profit until this year. What specifically do you pay attention to? We will make a public announcement after confirming the future progress. We have a plan right now, but it is difficult to answer precisely because of the problem that it may be canceled later. G&ST is a company whose main business is distribution business, environmental business and construction business. The head office is located in Jungwon-gu, Seongnam-si, Gyeonggi-do. The number of employees is It has Lumisys, which develops and manufactures lighting as an affiliate, and has a stake listed on the KOSDAQ market. The largest shareholder is Lee Jin-soo, the CEO, and the stake is .. Saenuri floor leader resigns and postpones until an extraordinary parliamentary session in January Hyun Byung-cheol increases his son's weight and public service controversy As soon as it arrives, request for a sound source leak investigation The world in the palm of your hand Unauthorized redistribution prohibited."
4,The Korea Exchange announced on the day that it would lift the suspension of G&ST's stock trading. G&ST's capital erosion rate has recovered to less than half a year. Reporter Ji Seon-ho A Window to the World An Eye to the Economy Asian Economy Unauthorized Reproduction and Distribution Ban Dancing Jackpot Psy Broadcasting Book The money required to marry a female partner after speaking English is shocking The reason why young men go shopping every weekend
5,"G&ST is recording the upper limit at the beginning of the market on the news of the free capital reduction decision. As of the morning of the morning, G&ST has soared to its price limit and is trading in won. With this, the capital has been reduced from 100 million won to 100 million won, and the issued stock has been reduced from 10 million to 10 million shares. The expected new stock listing is on the following Monday. Reporter Sang-hyuk Oh .. The largest pink diamond found in Australia The detachment team collapsed like dominoes and shuffled Vivid video Live video of limb amputation successful crossing the Strait of Gibraltar Ganluru humiliation Singing in kill heels Singing in the crease Miss Maxim Eom Sang-mi Eom Sang-mi's dizzying charm pictorial"
6,"G&ST announced on the same day that it would hold an extraordinary general meeting of shareholders at the lecture hall of the Saemaul Undong Central Training Center in Seongnam, Gyeonggi Province, next month, and propose agenda items such as approval for capital reduction and changes to the articles of incorporation. It also includes the content of increasing the total number of stocks scheduled to be issued from billions of shares to billions of shares. A typhoon is coming, but why is the weather so bad Typhoon Bolaven strikes Okinawa's state is about the same as the power of Bolaven on Jeju Island There has been an iPhone with rounded corners before. Unauthorized reproduction and redistribution prohibited"
7,"G&ST is rebounding after 1 day. As of the morning of the day, G&ST is . It is trading at the right-hand won. This is the first rebound in trading days since the last day. G&ST has been weak in recent years due to concerns over earnings. From the last day, it also recorded the lowest price for five consecutive days. Byung-cheol Yoo, World Finance Reporter . The broth girl who burned the child rather I resurrected the victim after a few days The old man who was resurrected After sleeping at an inn, he woke up to extort his kidneys, absurdly, overexposure, fined for a top model, danced on an animal whose chest was strongest in the cold On a polar bear On a penguin On a penguin on a penguin World Daily News World.com Korea We exercise copyright in accordance with the Digital News Usage Rules of the Online Newspaper Association."
8,"G&ST is hitting its lower limit for two days in a row. As of the morning of the morning of the day, G&ST is trading at a price lower than the previous day's price limit. Kim Seon-kyung, reporter for World Finance. The broth girl who burned the child rather I resurrected the victim after a few days The old man who was resurrected After sleeping at an inn, he woke up to extort his kidneys, absurdly, overexposure, fined for a top model, danced on an animal whose chest was strongest in the cold On a polar bear On a penguin On a penguin on a penguin World Daily News World.com Korea We exercise copyright in accordance with the Digital News Usage Rules of the Online Newspaper Association."
9,"G&ST, a KOSDAQ-listed company, announced on the same day that the submission and disclosure of the audit report was delayed due to the company's delay in data submission, and that it will disclose the audit report as soon as it is submitted by an external auditor. According to Article 1 of the Enforcement Decree of the External Audit Act, a listed corporation must submit an audit report to an external auditor and disclose it by the deadline. The key to investing in the Asian economy in my hand, which can be found anytime, anywhere... Reporter Lee Ji-eun A window to see the world An eye to see the economy Asian economy Unauthorized reproduction prohibited I bought a wallet, but Lee Kyung-gyu's life's jackpot secret It was Louis Vuitton that Kim Yuna ordered. Ginseng polysaccharide anti-cancer immunity enhancement action.. New hope for overcoming cancer Even Lee Seung-gi took Kim Yuna coffee"
10,프리엠스는 보통주당 원의 현금결산배당을 실시하기로 했다고 일 공시했다. 시가배당률은 . 배당금총액은 억만원이다.프리엠스는 지난해 영업이익이 전년대비 . 증가한 억만원을 달성했다고 일 공시했다. 매출액은 . 늘어난 억만원을 당기순이익은 . 늘어난 억만원으로 나타났다.플렉스컴은 신주인수권부사채 발행 추진설에 대해 시설자금 및 미래 투자 재원 확보를 위해  발행을 포함한 다양한 방안을 검토중이나 현재까지 조달 방법 규모 등은 확정된 바가 없다고 일 공시했다. 앞서 한국거래소는 플렉스컴에 대해 조회공시를 요구했다.한국제지는 지난해 영업이익이 전년 대비 . 증가한 억만원으로 나타났다고 일 공시했다. 매출액은 같은 기간 대비 . 감소한 억만원으로 당기순이익은 . 증가한 억만원으로 나타났다. 회사 측은 원재료가격 약세에 따라 이익이 증가했다고 설명했다.티에이치엔은 계열사 제이에스엔이 현대커머셜로부터 차입한 억원에 대해 억원의 채무보증을 결정했다고 일 공시했다. 이는 자기자본대비 .에 달하는 규모다. 채무보증기간은 년 월 일부터 년간이다.전북은행은 지난 분기 영업이익이 전년 동기대비 . 하락한 억만원으로 잠정 집계됐다고 일 공시했다. 매출액은 . 증가한 억만원으로 나타났다. 당기순이익은 같은기간 . 하락한 억만원으로 확인됐다.회사 측은 웅진여신 관련 충당금 억원을 추가 적립했기 때문에 해당 분기 실적이 감소했다고 설명했다.전북은행은 지난해 영업이익이 억만원으로 전년 대비 . 하락했다고 일 공시했다. 매출액은 억만원으로 전년 대비 . 증가했고 당기순이익은 억만원으로 . 감소했다.회사 측은 웅진여신 관련 대손충당금 억원 적립에 따른 영향으로 이익규모가 감소했다며 이 일회성 요인을 제외하면 실질적인 이익규모는 직전사업연도 대비 영업이익 약 억원 순이익은 억원 증가했다고 설명했다.코웨이는 년 월 일부터 년 월 일까지 자사주 만주를 처분한다고 일 공시했다. 처분가액 총액은 억만원 규모다.회사 측은 주식매수 선택권 행사에 따른 자사주 처분이며 회사의 법인계좌에서 개인 증권위탁계좌로 직접 이체한다고 설명했다.전북은행은 보통주 주당 원에 현금결산 배당을 하기로 결정했다고 일 공시했다. 시가배당률은 . 배당금총액은 억만원에 달한다.전북은행은 년도 영업이익을 억원으로 예상한다고 일 공시했다. 이어 매출액은 억원 당기순이익은 억원으로 전망했다.현대제철은 오는 일 한국거래소 층 국제회의장에서 국내외 기관투자자 등을 대상으로 기업설명회를 개최한다고 일 공시했다.롯데제과는 계열사 기린식품을 의 비율로 흡수합병하기로 결정했다고 일 공시했다. 합병 목적은 사업다각화 및 경영효율성 증대에 따른 통합 시너지 효과를 발휘하는 것이다. 합병기일은 월 일이다.상사는 계열사인   회사가 홍콩 하나은행 지점으로부터 차입한 억만원에 대해 채무보증을 결정했다고 일 공시했다. 보증금액은 자기자본대비 .에 달하는 규모다.대림통상은 지난해 영업이익은 전년대비 . 하락한 억만원을 달성했다고 일 공시했다. 매출액은 같은 기간 대비 . 하락한 억만원 규모이고 억만원 규모의 순손실을 기록했다.제일모직은 오는 월 일에 지난해 결산실적을 공시하고 분기 경영실적 설명회를 개최할 예정이라고 일 공시했다.케이티스카이라이프는 오는 일 케이티스카이라이프 국제회의실에서 증권사 애널리스트 및 기관투자자들을 대상으로 지난 분기 결산실적발표회를 연다고 일 공시했다.코스닥시장본부는 일 신민저축은행에 대해 최근 현저한 시황변동과 관련해 조회공시를 요구했다. 답변기한은 오는 일 오후 시까지다.호텔신라는 지난 분기 영업이익이 전년 동기대비  하락해 억만원을 기록했다고 일 공시했다. 매출액은  증가한 억만원 당기순이익은 . 감소한 억원으로 나타났다.호텔신라는 지난해 영업이익이 전년 대비 . 증가한 억만원을 기록했다고 일 공시했다. 매출액은 같은 기간 대비 . 증가한 조억만원 상당을 당기순이익은  늘어난 억만원 상당을 기록했다.회사 측은 외국인 관광객 증가로 인한 면세점 영업 호조가 매출액에 영향을 끼쳤다고 설명했다.위메이드엔터테인먼트는 오는 월 일에 지난해 분기 및 연간실적을 공시할 예정이라고 일 공시했다.지앤에스티는 운영자금 조달을 목적으로 억만원 규모의 유상증자를 결정했다고 일 공시했다. 유증은 일반공모 방식으로 진행되며 신주 예정 발행가액은 원이다. 할인율은 다. 일반공모 청약 예정일은 월 일이며 신주권 교부 예정일은 월 일 상장예정일은 월 일이다.위메이드엔터테인먼트는 주식매수선택권 행사에 따른 자기주식교부를 목적으로 자사주 주를 장외처분하기로 결정했다고 일 공시했다. 처분예정금액은 억만원 상당이다.호텔신라는 보통주 주당 원 종류주 주당 원의 현금결산 배당을 결정했다고 일 공시했다. 시가배당률은 각각 . .이며 배당금 총액은 억만원이다.승화산업은 오션인더블유가 메리츠종합금융증권에서 만주를 키이스트에서 만주를 장외매수했다고 일 공시했다. 취득단가는 각각 원 원이다. 오션인더블유의 승화산업 주식 보유 비율은 .다.기아차는 보통주 주당 원의 현금결산배당을 하기로 결정했다고 일 공시했다. 시가배당률은 .이며 배당금총액은 억만원 상당이다.는 지난해 분기 영업이익이 억만원을 기록해 흑자전환했다고 일 공시했다. 매출액은 억만원으로 잠정집계돼 전년 동기대비 . 증가했다. 당기순이익은 억만원으로  증가했다.넥센타이어는 지난해 영업이익이 전년 동기대비  증가한 억이라고 일 공시했다. 같은 기간 매출액은 . 증가한 조 억원 당기순이익은 . 증가한 억원을 기록했다.회사 측은 거래처 확대와 공장증설에 따른 매출증가 원재료 가격 하락에 따른 매출원가 하락이 실적에 영향을 끼쳤다고 설명했다.넥센타이어는 보통주 주당 원 종류주 주당 원에 현금결산 배당키로 했다고 일 공시했다. 시가배당율은 각각 . .였다. 배당금총액은 억만원이다.한국거래소는 한화스팩호에 대해 주권 상장 폐지 우려가 있다고 일 공시했다.회사는 기업인수목적회사로서 존립기한 만기 개월전까지 상장예비심사 청구서를 제출하지 않아 올해 월 일 관리종목으로 지정됐다.이와 관련해 회사가 관리종목 지정 이후 개월 이내 상장예비심사 청구서를 제출하지 않는 경우 상장폐지 기준에 해당된다.에스비엠은 김정환 김철수씨에서 김철수씨로 대표이사를 변경한다고 일 공시했다. 변경사유는 의사결정구조 일원화를 통한 신속하고 효율적인 경영활동을 강화하기 위해서다.회사측은 김정환 전 대표이사는 등기 사내이사로서 계속 경영에 참여할 예정이라고 설명했다.삼성카드는 지난해 영업이익이 전년동기대비 . 증가한 억원을 기록했다고 일 공시했다. 같은 기간 매출액은 매출액은 . 증가한 조억원 당기순이익은 . 증가한 억원으로 집계됐다.회사 측은 지난해 보유주식을 매각하면서 매출 및 이익이 증가했다고 설명했다.삼성카드는 보통주 주당 원에 현금결산배당을 실시키로 했다고 일 공시했다. 시가배당율은 . 배당금총액은 억만원이다.폴리텍은 벤처기업부가 중견기업부로 변경됐다고 일 공시했다.삼보모터스는 일 자동차부품 등을 주요사업으로 하는 계열사 삼보홀딩스의 주식 만주를 억원만원에 취득키로 결정했다고 공시했다.취득 후 삼보모터스의 삼보홀딩스 지분율은 다. 회사측은 프라코 인수를 위한 인수대금증자가 목적이라고 설명했다. 억매출 .평 과자가게 줄서서 샀더니.. 초에 억 슈퍼볼 광고 억쏜 기업은 이건희 마이바흐 고장나면배상금 억 김병만 정글촬영 중단 콩가개미 때문에 연말정산 환급액 궁금해 계산기돌렸더니김성은기자  저작권자  돈이 보이는 리얼타임 뉴스 머니투데이 무단전재 및 재배포 금지
11,"The Korea Exchange announced on the day that it would designate G&ST as a management item for reasons such as continuous operating loss for the last business year. Trading is suspended until the end of the day. Kyung-Min Kim View the E-Daily newspaper anytime, anywhere in your life Smart Economy Comprehensive Broadcasting E-Daily E-Daily Market Point, the best financial information terminal in Korea for real-time news and financial market E-Daily mobile service experts in the palm of your hand. Korea's best securities expert broadcasting E-Daily Customer Service Center Comprehensive economic information media E-Daily Unauthorized reproduction and redistribution prohibited"
12,The KOSDAQ Market Headquarters announced on the same day that G&ST will suspend stock trading due to the occurrence of a reason for designation as a management stock. The suspension period is until the end of the market. The hot issue at the opening of the shareholders' meeting season is the G&ST tear-jerking hand tank so many assassins lined up so many assassins are sold at a discount to the general public How the new Santa Fe interior is exposed and the handle is smiling. This visible real-time news Money Today is prohibited from unauthorized reproduction and redistribution
13,"G&ST announced on the day that the stake held by Jinsu Lee, the largest shareholder, had decreased from . to . Elpida Bankruptcy Wave How far was this car in G&ST Hyundai? When I asked why I couldn’t see the 10,000 won Ion Jonah or the unwrapped 10,000 won bill, how was it that I was defeated by the excited citizen commentator Yoo Si-min How to pass Samsung? This visible real-time news Money Today is prohibited from unauthorized reproduction and redistribution"
14,"G&ST announced on the day that it would exercise its preemptive rights for 10,000 shares. The exercise price is KRW 100 million per share. How far will Elpida bankruptcy go? I will buy a house in the old days if it becomes the G&ST lottery, etc. These days, Kim Moon-soo's handicraft nominations, transfers, and hand reactions are 10,000 times a day with stocks. Real-time news that shows the money of the copyright holder Money Today Unauthorized reproduction and redistribution prohibited"
