,0
147,"EDID Company announced that it has decided to conduct a location-based business with TycoVision, which is running its business in Thailand. In this case, the company decided to install the logistics location information system on 10,000 vehicles with a minimum expected quantity of 10,000 units and explained that the installation of pilot vehicles had already been completed. He said that he plans to spur further overseas location-based businesses including Southeast Asia. For major domestic businesses, the cellular method using mobile communication base stations and the method using satellites are used depending on the service method. The cell method is a method using a mobile communication base station and has the advantage of being able to find the location of a building or underground using a repeater, but has a limit in that only an approximate location can be identified because the error range is wide. This method allows for more accurate location tracking than the cellular method, but due to the nature of the satellite signal, it cannot be used indoors and is weak in high-rise buildings. Services Provided Services include transportation and navigation application services. Recently, thanks to the advancement of mobile communication networks such as intelligent transportation systems, it has been welcomed in transportation logistics and e-commerce. Reporter Jeon Pil-soo A window to see the world An eye to see the economy Asian economy Unauthorized reproduction and distribution The man who released the video Han Seong-joo That night Kang Ho-dong Chicken Months The man who made a big hit, but released the video of Han Seong-joo, this time the ginseng polysaccharide, ginseng, anti-cancer immunity, excellent anti-cancer immunity, breakup Jang Yoon-jung, shocking Noh Hong-cheol's shocking reversal"
148,"Incheon News Reporter Sang-Hwan Ham EDD Company has stepped out to make a leap forward as a global company. According to ILDD Company, it combines the company's own technology with Eddy Holdings, which is actively investing in electric vehicles, to produce electric vehicles, It is preparing to enter the eco-friendly business fields such as electric ship business such as electric yachts, electric boats, and electric agricultural machinery business. It has proven its superiority in performance and has higher fuel efficiency and economic feasibility than other electric vehicles of other companies. It is expected to respond to the efforts for strengthening and early commercialization. The electric sports car, which is currently being promoted as part of the electric vehicle business, is scheduled to be unveiled in the coming months. EDD Company is currently entering various eco-friendly business fields, such as electric yachts, electric boats, electric fishing boats, etc. We are working on an electric ship development project, and we plan to conduct a demonstration of an electric ship in the Han River in the middle of the month. In this regard, the International Maritime Organization's Marine Environment Protection Committee has a goal of reducing carbon dioxide emissions from ships by year by year, reducing carbon emissions in the shipping sector. The bill has been finalized. This bill has strong support from global environmental groups, and governments are considering introducing market-based reduction mechanisms such as carbon emission trading and taxation. The company said that a significant increase in sales is expected. In particular, according to the Korea-U.S. agreement that took effect from January 1, 2016, production in the fishery industry in Korea will decrease by about 100 million won annually, causing damage to fisheries workers, said a company official. As an alternative to this, Chairman Hyuk-kyu Kim of D Holdings said that by replacing the existing fishing boats with electric fishing boats, it is expected that the damage to the fishery industry will be alleviated by securing a stable foundation for the fishery industry by reducing fuel costs. A contract for eco-friendly agricultural machinery business, including tractors and multi-purpose agricultural machinery with electric motor system applied to a domestic agricultural machinery manufacturer, is imminent, and the amount to be exported under this contract will be 10,000 units in the Americas, etc., and will be expanded to other countries in the future. Along with Korea-US, which took effect in January, discussions are actively underway with China and Japan. Accordingly, if import duties are abolished or significantly lowered when importing agricultural products, Korean agricultural products will inevitably lose price competitiveness. However, the damage is expected to be passed on to the farmers. Therefore, the eco-friendly agricultural machinery business is emerging as an alternative that can minimize the damage to the farmers and solve the noise and environmental problems by securing the price competitiveness of domestic agricultural products by reducing the fuel cost. .In addition to strengthening the capabilities of the existing electric and electronic business, Eddy Company is jointly developing a smartphone mirroring terminal that can check smartphone information through the terminal based on the existing electric and electronic technology with a famous domestic telecommunication company. As part of various golf-related projects that are being planned, we have developed a low-end golf range finder for domestic and foreign golf courses, built a domestic golf course, and are conducting joint pilot operation and marketing. We are jointly carrying out the submarine cable alert project to prevent accidents in advance, and have completed the delivery of 10,000 units of warning devices to which electronic charts and programs are applied to Busan. He said that he is also considering entering into the first smart business equipped with various driving convenience functions, including a navigation function using a touch screen-type mobile phone function, etc. Starting with , he served as the governor of Gyeongsangnam-do until years such as the popular election.. Kang Ki-gap has never been a member of the Bundang party in the party Seeing the world in the hands of an overweight government official with the system Mobile News Copyright holder Sympathy media News News News Agency. Unauthorized redistribution prohibited."
149,"Eddy Company has stepped out to make a leap forward as a global company. According to the Japanese company, Eddy Holdings, which is actively investing in electric vehicles, combined its own technology with the company's own technology to produce electric vehicles, electric yachts, and electric boats. It is preparing to enter eco-friendly business fields such as electric ship business and electric agricultural machinery business in earnest. Eddy Company is the leader of the electric vehicle industry, which the government is actively promoting with the goal of electric vehicles becoming one of the world's largest electric vehicles by 2020 as well as solving environmental problems. It is expected to respond to the efforts for strengthening competitiveness and early commercialization. The electric sports car, which is currently being promoted as one of the electric vehicle businesses, will be introduced in the coming month. We plan to demonstrate an electric boat on the Han River in the middle of the year. Eddy Holdings Chairman Kim Hyuk-gyu said that by replacing the existing fishing boat with an electric fishing boat, it will be possible to secure a stable fishery base by reducing fuel costs, thereby mitigating the damage to the fishery industry. A contract with an agricultural machine manufacturer for eco-friendly agricultural machinery including tractors and multi-purpose agricultural machines with electric motor system is imminent, and it is expected that 10,000 units will be exported to the Americas under this contract. In addition to the smartphone mirroring terminal that can check smartphone information through the terminal, we jointly developed a low-end golf range finder for domestic and foreign golf courses, one of the golf businesses, and confirmed the location of the submarine cable on the electronic chart in advance with In addition, we are considering entering the first smart car business equipped with various operation convenience functions. We need to discuss whether the scan wave is bad or the eunuch is bad by Mong-Jun Jung. Legal basis for protection Gimbio Caltex Maekyung Open Golf Tournament Winner Eased workplace childcare installation conditions Yonhap News Mobile App Download Photo Magazine Copyright Holder Yonhap News. Unauthorized redistribution prohibited."
150,"Eddy Company announced that it will appoint Lee Choong-beom, who served as a secretary to the Blue House as an auditor of the newly established EDI Research Institute. After graduating from Gyeonggi High School, Lee Choong-beom, a new law student at Seoul National University, was appointed as the youngest secretary to the Blue House during the bar exam. It also became a topic of discussion. An official from the Eddy Company said that the recruitment of lawyer Chung-beom Lee along with the recently appointed advisor In-bong Jeong and the company laid the foundation for the development of the company and research institute while securing talent for reliable legal advice. He said that the role of two former lawyers in both the company and the research institute is very important because the expansion is based on the national policy of green growth. After declaring green growth as a national vision, it is being promoted by the government. As it aims to become one of the world's largest green powers by 2020, it is important to understand and apply the relevant laws and regulations. The key to investing in the Asian economy in my hand, which can be found anytime, anywhere... Reporter Jeon Pil-su A window to the world An eye to see the economy Asian economy Unauthorized reproduction and distribution Ban Lee Seung-gi Park Il, who worked well even if he was absent. Divorce lawsuit Na Hoon-ah, I found out that my wife was worried about her son because of the ginseng polysaccharide, which is excellent for enhancing anti-cancer immunity."
151,"Eddy Company is strong on the news of the start of negotiations between Korea, China and Japan. The company expects that Korea, China and Japan will benefit electric vehicle makers. As of the morning of the morning of the day, eddy Company is recording won, up KRW from the previous day. Eddy Company is strengthening cooperation in the fields of electric vehicle new and renewable energy along with the start of negotiations between Korea, China and Japan. It was analyzed that the adoption of a joint declaration calling for the government’s efforts to promote the development of new and renewable energy sources seems to have acted as a momentum. Samsung Electronics Vice Chairman Kang Ho-moon, who was in attendance, said that it was necessary to establish a standardization cooperation secretariat between Korea, China and Japan for the standardization of new and renewable energy fields for smart lead electric vehicles. Prohibition of distributing reprints Han Seong-joo's video scandal Go Young-wook who said that it was absolutely impossible to do this A text message sent to her, Jang Yoon-jung, who made a lot of money After years of business, ginseng polysaccharide ginseng acid anti-cancer immunity enhancement effect Excellent cancer overcoming Hwang Jeong-eum Shocking exposure What was it like?"
152,"Jati Electronics, a KOSDAQ-listed company, holds a regular general meeting of shareholders and concludes a contract for the transfer of stocks and management rights with Econex DD, and is newly launched as EDID Company. Other agendas such as the same agenda and changes to the articles of incorporation were resolved as originally planned. At the same time, new directors and auditors were appointed, such as Gyu-Dae Choi, Vice President of Econex ID, as CEO of EDID Company. He said that he would achieve annual sales of more than 100 million won from this year with the goal of becoming a global company in eco-friendly business fields such as electric, electronic, and medical devices in addition to existing businesses. He emphasized that it will grow into a leading global green company in the eco-friendly field that occupies most plan. Correspondent Kim Se-hyeong. Park Eun-ji butt pad incident Confession without mosaic Shocking divorce Oh Jeong-yeon My ideal type is Seo Jang-hoon Oh Jeong-yeon I have been like a married man for a long time Lim Yo-hwan Girlfriend Kim Ga-yeon Turns out I was a comedian Park Myung-soo, junior, Shim Jin-hwa, Kim Shin-young Shin Bong-seon, more weight than plastic surgery confession without permission Do not redistribute"
153,"The Bell|This article was published in the monthly capital market media Money Today. Econex DD completed the acquisition of Jati Electronics. Jati Electronics changed the company name to EDID Company and added electric vehicle business to its business purpose. Econex ID paid the balance of the sales contract to the seller, Lee Kwang-soon, CEO Lee Kwang-soon in the morning of the day. As a result, Econex DD took a stake in Jati Electronics and became the largest shareholder of Jati Electronics. Econex DD issued convertible bonds worth KRW 100 million last week to finance the acquisition of Jati Electronics. Investment & Securities participated as the sole underwriter and took over all of them. Jati Electronics made the final decision to change the name and add business purpose at the general shareholders' meeting held on the same day. The new name is Eddy Company. Sales of electric direct drive devices, remodeling and sales of electric direct drive buses were also added to the business purpose. The name of the new board of directors was also confirmed. In-bong Jeong, a former member of the National Assembly, and Gyu-ik Choi, a professor at the Graduate School of Creative Writing at Kookmin University, were named as new outside directors. The hot issue at the start of the shareholders’ meeting season is like Jati Electronics. The designer smiles at the pointed out and hesitates for a new Santa Fecho, the month is delayed. Gas price is only 10,000 won. Amore, the two of us who went to the countryside. Real-time news Money Today Prohibition of unauthorized reproduction and redistribution"
154,"The amount of cash equivalent to the amount of assets escaped from KOSDAQ-listed companies without any disclosure, which is embarrassing to investors. When a listed company directly lends money to another corporation, a disclosure obligation arises, but the funds are transferred through the underwriting of bonds. In the first half of this year, according to the electronic disclosure system of the Financial Supervisory Service (FSS) in Japan, EDID Company, a KOSDAQ listed company, lent a total of KRW 100 million to Econex, an unlisted company. The amount of money that escaped in the name of convertible bonds and long-term loans of 100 million won corresponds to . Eddy Company explains that it has invested in the news that Econex is going to start the electric vehicle direct drive business in earnest. It is argued that although a plan for recovery of investment was proposed, the accounting firm concluded that it was impossible to unilaterally measure the value of the Econex business. Before and after the news of the refusal of the audit opinion was announced, the stock price recorded the lowest price for consecutive trading days, causing damage only to shareholders. A KOSDAQ listed company is obliged to disclose when it lends more than its equity capital to other corporations or acquires stocks of other corporations. do. However, if you lend money to another corporation through bonds with warrants, etc., it is recognized that you have acquired a financial product called bonds, and there is no obligation to disclose it regardless of the amount. Eddy Company provided funds to Econex in the form of acquisition of convertible bonds and long-term loans The 100 million won was also below the equity capital of the Eddy Company at the time, so there was no obligation to disclose it. An official of the Korea Exchange said that, in addition to corporate bonds, there are financial products with high repayment potential and strong investment purposes, such as government bonds and bank bonds. He said that it was difficult to determine whether it was a financial product acquisition. Accordingly, there was a controversy over whether the disclosure of bond acquisitions should be mandatory, but now it has become the custom not to disclose it. Reporter Jeong In-ji of Hankyung.com. Lee Ha-nui shakes her perfect body Shakes with a moldy stench in Hetbahn Surprised Han Ye-seul's recent appearance There is no other autumn goddess Park Si-yeon Unedited Directly taken after marriage A more beautiful look after marriage Susuke vs. Ulzzang Someone saw it and it's a girl group A habit that calls for success Hankyung.com unauthorized reproduction and Copyright is exercised in accordance with the Digital News Usage Rules of the Korea Online Newspaper Association, which is prohibited from redistribution."
155,"The KOSDAQ index failed to keep up. The KOSDAQ index on the day was higher than the previous day. dropped . was recorded. Individuals net bought 100 million won, but foreigners and institutions net sold 100 million won each, bringing the index down. The above Celltrion share price is . It came down and the Paradise above is . fell Among the top-ranked stocks by market cap, the stock prices of dog stocks fell, and the stock prices of dog stocks rose. Damul Multimedia finished the transaction at the upper limit, and the Woosung Feed went up. The stock price of AhnLab NeoMtel Mirae Industries also rose. On that day, each stock hit the upper limit in the KOSDAQ market. Eddy Company is the only stock in the low-gain business. Chosun Biz Hot News Snake is good. What are the industry-exclusive benefits? Home shopping rice thief soy sauce crab. Amazing."
156,"Daily public offering new stock allocation basis Ilsol Go Biomedical Rights Rak Hansol Technics common stock additional listing Glostech Welcron Hantech Hysonic Cottrell Fine Digital Mycoil paid subscription Daewoo Atechkiss & Company Media Polyvision ED Huvitz Il Paid Subscription Hyundai Merchant Marine Shinsung Solar Energy Texel Netcom General Public Offering DD Company Il Paid Subscription Shinsung Solar Energy Texel Netcom Hyundai Elevator General Public Subscription EdD Company IDN Il Paid Subscription Hyundai Elevator General Public Offer Leading Soft Eun support After the campaign, students are nervous about receiving additional national scholarships like someone who did something wrong Unauthorized reproduction and redistribution prohibited"
157,일 주식시장에서는 대선 주자들이 후보 등록을 마치고 본격적인 선거운동에 들어간데 힘입어  관련주가 급등세를 보이고 있다.  관련주들의 강세는 양 후보 모두 페이스북과 트위터 등 다양한 를 통한 적극적인 선거운동에 나설 뜻을 밝힌 바 있기 때문으로 풀이되지만 최근 잇단 주가 강세는 기대 실적에 비해 과도하다는 분석이 지배적이어서 급등 후 폭락에 따른 휴유증이 우려된다. 오전 시 분 현재 이루온과 오늘과내일이 가격제한폭까지 급등하며 각각 원과 원으로 상한가를 기록 중이다.가비아와 케이아이엔 인포뱅크 나우콤 등도 동반 상승세다.제일모직은 분기 사상최대 수준의 영업이익이 전망된다는 분석에 힘입어 . 오른 만원을 기록하고 있다.김병기 키움증권 연구원은 제일모직의 분기 매출액은 조억원 영업이익은 억으로 전년대비 각각   증가할 것이라며 분기 일시적 부진을딛고 분기 가파른 이익성장이 예상된다고 말했다.조비는 최대주주 대상으로 유상증자를 실시했다는 소식에 . 상승한 만원을 기록 중이다. 조비는 전날 운영자금 마련을 위해 경농과 서영실업을 대상으로 약 억원 규모의 제자배정 유상증자를 결정했다고 공시했다.예당은 서태지의 컴백 가능성이 알려지며 . 상승한 원에 거래되고 있다.이날 서태지닷컴은 다음 활동 첫 콘서트라는 이벤트에 팬들을 직접 초대한다고 밝혔다. 예당은 서태지컴퍼니의 지분 .를 보유한 대주주로 차기 발매 앨범의 음반 유통에 관한 우선 협상권을 가지고 있다.소리바다는 영국 최대의 일렉트로니카 음반사와 계약을 체결했다는 소식에 이틀째 급등하며 전일보다 . 뛴 원에 거래중이다. 온라인음원 서비스업체 소리바다는 어제 영국 최대 일렉트로니카 전문 음반사인 툴룸 레코드와 음원 공급 계약을 체결했다고 밝혔다.툴룸 레코드는 유럽의 가장 큰 일렉트로니카 레이블로헤드라이너 페디 르 그란데와 마크 나이크 라미레즈 스테파노 노페리니 등의 아티스트가 계약을 맺고 있다.승화명품건설은 인공간 개발업체 헤파호프의 지분을 취득했다는 소식에 장초반 . 오른 원을 기록하며 주 신고가를 기록한 후 차익매물에 밀려 하락 반전하고 있다.전일 승화명품건설은 헤파호프의 주식 만주를 억 만원에 취득한다고 공시했다.년 월 미국 실리콘밸리에 설립된 헤파호프는 올해 월 미국 으로부터 임상승인을 받기도 했다.마크로젠은 내년에 사상 최대 실적을 기록할 것이라는 전망에 . 오른 만원에 거래되고 있다.신한금융투자는 마크로젠이 올해 매출액 억원 영업이익 억원을 기록할 것으로 추정했다.배기달 신한금융투자 연구원은 올해 매출액과 영업이익이 지난해보다 각각 . . 증가할 전망이라며 지난해 선보인 글로벌 프리미엄 유전자 브랜드  매출 확대와 해외 수출 증가에 따른 것이라고 설명했다.그는 이어 내년 매출액은 전년 대비 . 증가한 억원 영업이익은 . 늘어난 억원에 달할 것이라고 덧붙였다.파라다이스는 이틀째 급락하며 . 하락한 만원을 기록중이다. 하반기 들어서만 . 오른 파라다이스는 최근 들어 급격한 상승에 따른 조정을 받고 있다.키스톤글로벌은 석탄 판매 계약을 체결했다는 소식에 . 오른 원에 거래되고 있다. 키스톤글로벌은 쇼지트레이드코퍼레이션과 억원 규모의 석탄 판매 계약을 체결했다고 이날 공시했다. 이는 최근 매출액의 .에 해당한다.대한전선은 유상증자에 글로벌 전선업체인 일본 스미토모가 참여한다는 소식에 . 상승한 원에 거래되고 있다.대한전선은 전날 최대주주인 대한시스템스가 유상증자에 참여할 수 있는 권리인 신주인수권증서를 계열사인 대한광통신과 일본 스미토모 전기에 매각키로 했다고 밝혔다.대한시스템스는 배정받은 신주인수권증서 만주 가운데 만주는 계열사인 대한광통신에 만주는 스미토모전기에 각각 매각했다고밝혔다. 스미토모가 신주인수권 증서를 행사 유상증자에 참여하면 약 의 지분을 확보하게 된다.엔씨소프트는 거래일 연속 상승하며 . 오른 만원에 거래중이다. 우리투자증권은 엔씨소프트에 대해 분기 기대에 못미친 실적 발표와  시장에 대한 불안감이 반영최근까지 주가는 급락세 시현했다며 리니지과 길드워의 매출 호조세 와일드스타나 리니지이터널 등 차기작 파이프라인과 블레이드앤소울과 길드워의 중국 서비스 개시 및 길드워 확장팩 출시 등 내년에도 성장 기대된다고 분석했다.이디디컴퍼니는 대규모 유상증자 소식에 . 내린 원을 기록중이다.이디디컴퍼니는 전날 운영자금 억천만원을 조달하기 위해 신주 만천주를 발행하는 일반 공모 방식의유상증자를 실시하기로 결정했다고 공시했다.이트레이드증권은 . 오른 원에 거래되고 있다. 이트레이드증권 인수합병에 가 관심을 가지고 있다는 일부 언론 보도에 대해 전날 한국거래소는 에 대해 이트레이드증권 또는 아이엠투자증권 인수 추진설에 대한 조회공시를 요구했다. 답변 시한은 이날 오후 시까지다.리테일은 편의점 영업거리 제한 문제로 기관과 외국인 매물이 출회되며 . 하락한 만원을 기록 중이다. 사흘 연속 하락세로 전날 주가는 . 떨어졌다. 여영상 한국투자증권 연구원은 공정위가 편의점 영업거리제한 안을 검토한 바 없다고 해명했지만 향후 규제는 있을 것이라며 편의점 성장성이 둔화할 것이라고 밝혔다.. 여친과 헤어진 군인 휴대폰 동영상 촬영 논란 신이 정한 와이파이 존  진짜 절묘하다 선예 사실 속도위반했어요 다시화제 화성인 사이버여신 남친과 웹캠 데이트 싸이 대선주자에 강남스타일금지. 왜 헤럴드 생생뉴스   헤럴드경제  . 무단 전재 및 재배포 금지 
