,0
232,"The following is the news of major stocks after the close of the stock market. Morrins Provides collateral for delinquency in principal and interest on delinquency on matters under consideration, such as discussions with creditors and disposal of tangible assets for a significant stock price drop. announced that part of the principal and interest of bonds with warrants for replying had been repaid by selling the company. The stake ratio in the Minimum Collection is ..Announcing that it has sold 10,000 shares of its treasury stock over the counter in order to issue treasury stock following the exercise of the Coway stock option. The debt guarantee amount is 100 million won. Samsung Electronics announced that Samsung Life's special account sold its common stock on the stock exchange from the last day to the day of last month and purchased the stock. It was announced that it had signed a supply contract with SeboMC Samsung Engineering for wastewater piping work during the new line construction worth KRW 100 million. This is the latest in sales, and the contract period is from Monday to Monday. It was announced that the company name would be changed to ILJIN Power while establishing a new company ILJIN Plant through physical spin-off of the ILJIN Energy Chemical Plant business. Announced that Mr. Lee Hwan-geun was changed to Dongwon Systems. Dongwon Systems announced that it had decided to lend KRW 100 million to a subsidiary of JC Chemical. This corresponds to the ratio of equity capital and the total loan balance is KRW 100 million. In order to strengthen the synergy of the business of Mega Study subsidiaries and increase management efficiency, Mega MD announced that it has absorbed and merged the first-class law school for entrance examinations at the Graduate School of Law. Announced that the exercise price of warrants was adjusted from 10,000 won to 10,000 won due to the decline. The number of new shares is 10,000 shares and the par value is KRW. The base date for new share allocation is the month and day of the month. Meanwhile, the Korea Exchange suspends trading with Eco Energy Holdings. Announces that it has obtained a patent for an inter-M voltage clamp step-up boost converter. With the acquisition of new shares following Dongwon Systems’ participation in capital increase, Hanjin PNC, a plastic film sheet manufacturer and distributor, is affiliated with Hanjin PNC. Announced that it will suspend new orders for all domestic business sectors, including special cables for ships and offshore cables, and industrial special cables of its subsidiary company, Cable Wire. The reason for business suspension was business reorganization due to quality problems of nuclear power cables. The amount of business suspension was 100 million won. Samyang Biopharm, a subsidiary of Samyang Holdings, announced that it would acquire 10,000 shares of a financial holding company for 100 million won. After the acquisition, the ownership stake is ., and the acquisition date is expected to be in the coming days. Transthermal Asia Holdings announced that it had decided to issue a public offering worth 100 million won to finance its operation. The new stock to be issued is 10,000 common stock, and the issuance price of the new stock is Won. Beomyang Geonyoung Summit Asset Strategies Korea announced that it owns . Announcing that the probation period for 10,000 shares of the company's common stock will be lifted in the coming days."
233,"Morrins announced on the same day that it was designated as a corporation with infidelity in accordance with the delayed announcement of the decision to dispose of its treasury stock. Accordingly, from the following day, Morrins' stock trading will be suspended. prohibition"
234,"The news of the restructuring of the share price of Morin's, a mobile phone touch screen panel company, is unusual for the Herald Economic Daily, reporter Cho Hyun-ah. In a public announcement after the market close, Morins announced that it had decided to dispose of 10,000 shares of its treasury stock for repayment of principal and interest. In addition, we are seeking various restructuring measures, including personnel restructuring, consultation with creditors on the sale of tangible assets, and other efforts to attract investors through changes to the articles of incorporation, in order to improve the current difficult financial structure through inquiry and disclosure answers to recent significant market fluctuations. As of the morning of this day, as of the previous trading day, . It is being traded at the lowered Won.. Herald Saengjin News Herald Economy .. Unauthorized reproduction and redistribution prohibited Herald Economy Mobile Web Shortcut Mobile App Download |"
235,"Morins announced on the day that he had not been able to repay the principal and interest on a KRW 100 million bond. In this case, the outstanding amount of the outstanding loan issued in January and February is equivalent to the amount of equity capital. Morrins said that he could not afford to repay the principal due to the company's circumstances, and discussed with a private equity company specializing in job creation small and medium-sized enterprises, which is the subject of bond issuance, on a plan to extend the extension until the end of this month. Reporter Shim Jae-hyun Real-time news that shows the money of the copyright holder Money Today Prohibition of unauthorized reproduction and redistribution"
236,"The KOSDAQ market headquarters of the Korea Exchange announced on the day that Morins delayed the disclosure related to the decision to dispose of treasury stock and announced that it would be designated as a disloyalty disclosure corporation. If this happens, trading may be suspended for one day."
237,"The KOSDAQ index, which started slightly lower than the previous day, is turning upward in the early part of the market. As of the hour and minute, the KOSDAQ index is recording a . Currently, individuals are net selling 100 million won and foreigners are net buying 100 million won. Institutions are also buying 100 million won, of which Investment Trust is net buying. Most of the KOSDAQ industries are on the rise. Telecommunication equipment, metal, telecommunication service parts, non-metal, Internet software sectors are on the rise. The stock prices of related parts stocks on the KOSDAQ market are rising due to the opening in Las Vegas from the beginning of the day. LB Semicon is recording its upper limit, and its lumens are also rising. As Saenuri Party lawmaker Jeong Mong-joon announced his will to challenge the next presidential election, companies classified as theme stocks are rising. Hyundai Telecom is on the rise, and Koentech is on the rise. Among individual items, Hallyu star Bae Yong-jun's agency, Key East, is rising more than the day before on news of a KRW 100 million drama contract. than the day before on the news that it had stopped. It is trading at a lowered won. Among the top stocks by market capitalization, Seoul Semiconductor is on the rise, and Celltrion is on the rise. Home shopping, SM, O Shopping, Seegene, etc. are showing a slight upward trend. East-West Medytox POSCO is on a slight decline. Currently, 5 stocks are recording their upper limit, and each stock is on the rise. Stocks are down and stocks remain flat. There are no stocks recording a lower limit."
238,"General public offering issue of 10,000 new shares to raise 100 million won of PC Direct operating funds. Non-payment of principal and interest on bonds worth KRW 100 million occurred. Merger with Fine Technics subsidiary HK Hitech. Seoul Semiconductor on the basement floor of Daewoo Securities headquarters in Yeouido next month. Announced the quarterly business results in . Acquired a patent for a double reset device using a forty reset circuit. Former CEO Hongki Kim was promoted to vice president and concentrated on facility development. Acquired a patent for a payment security system and method using Solasia short-distance wireless communication."
239,"Morins announced on the day that there had been unpaid principal and interest on bonds worth KRW 100 million. This is the size of equity capital. The company announced that it will repay the principal and interest on unpaid bonds through asset restructuring. Gye-Young Kye-Young Gyung-Young E-Daily News Anytime, Anywhere in Your Life Smart Economy Comprehensive Broadcasting E-Daily Real-time News and Breaking News Mobile News App | Edaily Marketpoint, Korea's best financial information terminal for mobile stock trading traveler experts. Securities Expert Broadcasting E-Daily Customer Service Center | Stock Diagnosis Recommendation New Open Comprehensive Economic Information Media E-Daily Unauthorized reproduction and redistribution prohibited"
240,"It fell to the lower limit on the news that Maurice was designated as an investor alert. According to the electronic disclosure of the Financial Supervisory Service, Morin's was designated as an item to alert investors as of the previous day due to reasons such as inappropriate internal accounting management system. In addition, Morins is also designated as a management item for reasons such as excessive loss of equity capital during the recent business year. Morins, a mobile phone parts maker, achieved sales of KRW 100 million last year, but operating losses and net losses were KRW 100 million and KRW 100 million, respectively. reached It recorded an operating loss of 100 million won and a net loss of 100 million won in the same year. Bieber's affair Barbara Palvin's all-nude underwear pictorial shake Ryu Hyun-jin Do you want to pass the innings Bonus 10,000 dollars Cheerleaders' smooth legs Controversy at department store clothing repair shop Illegal contract controversy Ahn Young-mi also took off Gagwoman's first all-nude pictorial release"
241,"The KOSDAQ rose for the first trading day on the back of foreign buying. The KOSDAQ index rose .point on the previous day and recorded . Institutions had the advantage of selling 100 million won, while individuals had the upper hand. By industry, the upward trend prevailed. constraint. and transportation, medical precision equipment, Internet, computer services, manufacturing, chemistry, other services, food, beverages, tobacco, semiconductors, machinery and equipment showed strong performance. Broadcasting service entertainment culture Non-metallic telecommunication broadcasting service finance was weak. Stocks with the highest market capitalization showed mixed results. Celltrion. It soared, and Seongkwang Bend after Seoul Semiconductor also jumped. O Shopping Paradise Home Shopping Seegene Medytox SM fell sharply. In the KOSDAQ market, dog stocks including high-end dogs rose. The dog event closed flat, and the dog event slipped. There was no lower limit. In addition to Celltrion, Intron Bio, Celltrion Pharmaceutical, Kyungdong Pharmaceutical, Jinyang Pharmaceutical, Legochem Bio, Hwail Pharmaceutical, etc. jumped. showed Jeryong Industrial and Emerson Pacific recorded the upper limit. On the other hand, Morin's . It fell. Reporter Jung In-ji, copyright holder Real-time news that shows money Money Today Prohibition of unauthorized reproduction and redistribution"
242,"Morins announced on the day that it would sell 10,000 shares of its treasury stock for repayment of principal and interest. The expected disposal amount is billions of won. Oh Hee-na View E-Daily newspaper anytime, anywhere in your life Smart Economy Comprehensive Broadcasting E-Daily Real-time News and Breaking News Mobile News App | Edaily Marketpoint, Korea's best financial information terminal for mobile stock trading traveler experts. Securities Expert Broadcasting E-Daily Customer Service Center | Stock Diagnosis Recommendation New Open Comprehensive Economic Information Media E-Daily Unauthorized reproduction and redistribution prohibited"
243,"Morins, a KOSDAQ-listed company, held a board meeting on the same day and decided to dispose of 10,000 shares of its treasury stock. The estimated amount of disposal is billions of won, and the purpose of the disposal is to repay the principal and interest."
244,"The Herald Economy Reporter Cho Hyun-ah The stock price of Morin's, a mobile phone touch screen panel company, rose to its price limit for two days in a row, drawing the attention of investors. I finished the chapter in the circle on the right. The trading volume was Manchuria. In particular, on this day, Morin's stock price hit the upper limit for consecutive trading days following the previous trading day, and the market's attention was focused on drawing such a steep upward curve. Compared to the beginning of the month, it is on an upward march.. Camping season thrifty camper tent set up This is the Marine Corps camp accident and instructor Oh Yeol-gang Ye-bin, sleeveless, perfect volume body Clara father and daughter exposed fashion If more daring, Seo Yu-ri Yeo Min-jeong exposure parody Undoing the shoulder strap and herald Live News Herald Economy . Unauthorized reproduction and redistribution is prohibited. Korea Herald Youth Diplomacy Academy Participation Recruitment Herald Economy Mobile Web Shortcut Mobile App Download |"
245,"Morins revealed that there was no important information to be disclosed separately in response to notices and disclosures related to significant market fluctuations. Breaking News Mobile News App | Edaily Marketpoint, Korea's best financial information terminal for mobile stock trading traveler experts. Securities Expert Broadcasting E-Daily Customer Service Center | Stock Diagnosis Recommendation New Open Comprehensive Economic Information Media E-Daily Unauthorized reproduction and redistribution prohibited"
246,"The Korea Exchange (KRX) announced on the day that it had requested disclosure of related inquiries regarding the recent significant market fluctuations. The deadline for answering is until the afternoon of the next day. Do-nyeon Kim The small housing market is shaken by the brutal supply of one-room studios in the university district. Incheon Airport highway tolls are cut from day one. Empathy with people who are gaining weight. Must go Passengers getting off the plane Anytime, anywhere in your life E-Daily Newspaper Quick View Smart Economy Broadcast E-Daily Real-time News and Breaking News Mobile News App | Edaily Marketpoint, Korea's best financial information terminal for mobile stock trading traveler experts. Securities Expert Broadcasting E-Daily Customer Service Center | Stock Diagnosis Recommendation New Open Comprehensive Economic Information Media E-Daily Unauthorized reproduction and redistribution prohibited"
247,"The Bell | This article was published in the capital market media Money Today on Monday. Interest is growing whether the touch screen panel maker Morins will succeed in turning to profit this year. Achieving stable sales and profits. However, the performance deteriorated as the mobile phone market rapidly changed to the capacitive method. In order to respond to the market change, Morins has made a large-scale facility investment from 2011 and is planning to mass-produce touch panel products with integrated cover glass from this quarter. This is also the reason why Now Capital recently invested KRW 100 million in Morin's issue. Failed to respond to loss-transfer capacitive touch panel The performance of Morinth, a company listed on the Tokkosdaq, has been on a downward trajectory since 2011. Sales hit an all-time high of billions of won per year, and then halved to 100 million won at the end of the year. During the same period, the operating profit changed from 100 million won to an operating loss of 100 million won. Although sales increased slightly last year, it did not succeed in turning around by recording sales of 100 million won and operating loss of 100 million won until the quarter. The failure to respond quickly to changes was largely affected. Major customers, Samsung Electronics and Samsung Mobile Display Electronics, sharply reduced the proportion of resistive touch panels from . However, as Morins was unable to produce capacitive touch panels, the facility utilization rate fell sharply. The fixed cost burden increased further as the facility was changed to capacitive type in a hurry. Morins planned to mass-produce the glass-integrated touch panel in 2018, but could not achieve proper performance because it did not get approval from the customer. An analyst at a securities firm said that, despite the technological superiority of the resistive touch panel, Morins spent too much time and money on the production of the capacitive touch panel. Requires verification such as turnaround expected defect rate for mass production of touch panel It has already replaced the touch panel equipment with a method that has already invested 100 million won, and has also obtained approval for delivery from customers such as Samsung Electronics. This is the reason why we can expect an earnings turnaround as sales increase again this year. Morins has recently secured KRW 100 million in bonds with warrants to supplement issuance facilities and to secure operating funds. A Maurins official said that if the mass-produced touch panel is mass-produced, the performance will be greatly improved, and a turnaround is expected as early as this quarter. This is because competitors that mass-produce capacitive products are already occupying the market, and they have to verify the defect rate, etc. In fact, the products that Maurins will mass-produce are not expected to be applied to Samsung Electronics' new products, but to low-end smartphones. It means that there is a difference in technology with competitors. An official from a touch screen company said that although Maurins-style touch panel facilities were prepared, it takes about a quarter more time to lead to an increase in sales or profits. Now Capital Morinth invested billions Reporter Donghee Kim Copyright holder Real-time news where money can be seen Money Today Prohibition of unauthorized reprinting and redistribution"
248,"Maurice announced on the day that the exercise price of new stocks would be adjusted from KRW to KRW in accordance with the fall in the market price. After adjustment, the number of stocks that can be exercised will increase to Manchuria. Ahn Young-mi until her belly fat nude pictorial. Was she in this body? Thrilling Seven Lettuce Ground Gold Massage Parlor Lady Service Field Celebrity Soldiers Entering Massage Parlors and Fighting Herald Live News Herald Economics . Unauthorized reproduction or redistribution is prohibited. Herald Economy Mobile Web Shortcut Mobile App Download |"
249,"As a result of submitting an audit report last year, Morins announced on one day that the loss rate before deduction of corporate tax expenses for the most recent business year exceeded . Morins recorded sales of 100 million won last year, operating losses of 100 million won, and net losses of 100 million won. Samsung high school graduates Cho Young-man, a month after joining, Han Hye-jin took Ki Seong-yong and Lee Gyeong-gyu's old remarks Hot topic Home shopping appearance Park Tae-hwan Eventually, Samsung Electronics became Noh Won-byeong and Heo Jun-young. Ahn Cheol-soo. Why is one Jindo dog issued? Why do you throw a grenade? Reporter Eun-ryung Kim, copyright holder Real-time news where money is visible Money Today Bans unauthorized reprinting and redistribution"
250,"The KOSDAQ Market Headquarters of the Korea Exchange announced that it would designate Maurice as a non-faithful disclosure corporation on the grounds of overturning the disclosure related to the cancellation of the treasury stock disposal decision. The realistic reason for Kim Ki-hoon's marriage is loneliness. If you see symptoms, you should suspect diabetes .Visible countermeasures Effectiveness of countermeasures The housing market is wriggling. Don't come out from tomorrow.. You have to pay severance notice Anytime, anywhere in your life View the E-Daily Newspaper Smart Economy Broadcasting E-Daily Real-time News and Breaking News Mobile News App | Edaily Marketpoint, Korea's best financial information terminal for mobile stock trading traveler experts. Securities Expert Broadcasting E-Daily Customer Service Center | Stock Diagnosis Recommendation New Open Comprehensive Economic Information Media E-Daily Unauthorized reproduction and redistribution prohibited"
251,"The KOSDAQ index ended strong on foreign and institutional buying. The KOSDAQ index on the day recorded a .point increase compared to the previous day. The index fluctuated during the day, but it caught on as it rose in the second half of the market. Foreigners net bought 100 million won worth of stocks. Institutions also had an advantage in buying billions of won. Individuals showed a net selling of 100 million won. By industry, the uptrend prevailed. Publication media, reproduction, pharmaceutical, semiconductor, and communication equipment rose. Construction, entertainment, culture, manufacturing software, food and beverage, tobacco, transportation, transportation equipment, parts, digital content also gained strength. Broadcasting services, telecommunication and broadcasting services showed a major weakness. Stocks were mixed. Celltrion responded to the news that a stake sale was underway. went up Seoul Semiconductor. soared Posco SM Sungwoo Hitech rose more than ever. On the other hand, O Shopping home shopping broadband Seegene Medytox fell behind. In the KOSDAQ market, dog stocks, including high-end dogs, rose. Dog stocks closed flat, and dog stocks such as dogs fell at the lower limit. On the news that the price of polysilicon was rising, Solmics recorded the upper limit. Renéco also jumped to the upper limit for the second day on the news that it had decided to sell its shares in IDES to improve its financial structure. In addition, Maurin's Ohsung LST Thinkware and others recorded high prices. fell. Hyundai Telecom showed the lower price. Reporter Jung In-ji, real-time news that shows the money of the copyright holder Money Today Prohibition of unauthorized reproduction and redistribution"
252,"Morins announced on the day that it decided to dispose of 10,000 shares of its common stock last month to provide incentives to its employees, but it was later designated as a management item and the decision was canceled because it did not dispose of its treasury stock. Go Du-rim’s school uniform selfie button is too hard to lock, so the terrorist brothers were made by their mother, the family history side apologized for the Tokyo Dome performance controversy Visible real-time news Money Today Unauthorized reproduction and redistribution prohibited"
253,"Morins said that the audit report should be submitted by the end of the day, but the disclosure of the audit report is delayed due to the delay in the audit schedule of the external auditor. AhnLab's official announcement..How did the vaccine management server break through? The sodium-stained calorie intake of yeolmu naengmyeon was the first public release of Hyundai Motor's sports coupe concept car. Financial market in the palm of your hand in news and securities trading E-Daily Mobile Service Comprehensive Economic Information Media E-Daily Unauthorized reproduction and redistribution prohibited"
254,"The Korea Exchange has requested disclosure of inquiries related to the remarkable stock price surge for Suseong. The deadline for responses is until pm on the following day. If Clara's father and daughter's exposed fashion were more drastic, Seo Yu-ri and Yeo Min-jeong's exposure parody loosened the shoulder strap The Herald Live News Herald Economics . Unauthorized reproduction or redistribution is prohibited. Korea Herald Youth Diplomacy Academy Participation Recruitment Herald Economy Mobile Web Shortcut Mobile App Download |"
