,0
67,"Goldstar Tech announced on the day that it recorded a subscription rate of . The company announced that 100 million won was invested in the recruitment of a total of 100 million won. Orient Present decided to sell the land and buildings located in Seongbon-ri, Daeso-myeon, Eumseong-gun, Chungcheongbuk-do, to the affiliate Orient Electronics for 100 million won in order to improve the financial structure due to debt repayment and debt repayment. announced that it did. This is relative to total assets. The Korea Securities Market Headquarters announced on the day that it would designate Daeyang Metal as a non-faithful disclosure corporation on the grounds of non-disclosure. Accordingly, the trading of Daeyang Metal's stock will be suspended for the next day. The accumulated demerit points increased to points as demerit points were imposed. If the accumulated penalty points are more than the points, it may fall under the criteria for designation as a management item. The Korea Securities Market Headquarters announced on the day that Lotte Tourism Development has overturned the disclosure related to the Pocheon Eco Design City Tourism, Recreation and Leisure City development project in Gyeonggi-do and designated it as an unfaithful disclosure corporation. Accordingly, Lotte Tourism Development announced on the day that it had signed a private contract for the use of the brand with its affiliate CheilJedang, which said that trading would be suspended for one day. The transaction amount is 100 million won, and the contract period is from the first of the month to the next. Yerimdang participated in the disciple allocation capital increase and became the largest shareholder by securing a stake in Ains. However, the company said that there is no specific fact confirmed on the related matters because the company has not yet been served with the complaint regarding this case so far, and it will be republished within the time or months when the specific details are finalized. Energy announced on the same day that the Ulsan District Court ordered the plaintiff to pay 100 million won to the lawsuit filed by the plaintiff Hyundai Heavy Industries. The judgment amount is compared to UI Energy's equity capital. is the size The company said that this judgment was based on the establishment of mediation and that it would be implemented according to the mediation of the court. Tri-Circle announced on the same day that the foreclosure of real estate had been lifted due to the withdrawal of the case by the Credit Guarantee Technology Credit Guarantee Fund. It was announced on the same day that it had submitted an appeal against the court's ruling on the lease payment lawsuit. Earlier, on the day of last month, Jindo announced that the Seoul Southern District Court ordered E-Land Park to pay 100 million won in a lease payment lawsuit filed by E-Land Revisit in January. did. This corresponds to the ratio of equity capital. Ubicom announced on the day that CSJ Networks filed with the Suwon District Court Seongnam Branch of the Suwon District Court for an injunction to suspend the execution of duties, such as the representative director, and to withdraw the application for the appointment of an agent. Regarding the recent significant market fluctuations, there is no important information to be disclosed separately. However, as a company specializing in building an intelligent transportation system video integrated control center, the company responded that it is participating in a bid for a business that has the government and local governments as customers. He added that nothing has been decided at this time, and that it will be disclosed according to the announcement of the bidding results in the future. Shinsegae announced on the same day that it would transfer the tangible assets executed before the establishment of the Shinsegae Dongdaegu Transit Center for 100 million won. The company announced that tangible assets will decrease and cash assets will increase with this asset transfer. Woongjin ThinkBig announced on the day that it had purchased 10,000 shares of its treasury stock. As a result, Woongjin ThinkBig's largest shareholder's stake increased to . 100 million won will be used for facility funds, and the rest of the operating funds will be used for other funds. The maturity date is the next tenth of the year, and the maturity interest rate is C. The exercise price of warrants is KRW per share. Rising on anticipation of support from Spain Declined on weakness in technology stocks Reversal Incumbent president’s brother’s first arrest in constitutional history Impact of the rainy season across the country In the afternoon, all key aides were arrested, including the president’s older brother, reporter Park Hee-jin Real-time news that shows money prohibition"
68,"The Seongnam Branch of the Ubicom Suwon District Court decided to withdraw the lawsuit filed by the plaintiff CSJ Networks for the application for suspension of the execution of the representative director's duties. Kyung Bong-ju answered that he is participating in a bid for a business that has the government and local governments as customers through an inquiry and disclosure response related to the surge, and that in the future, according to the announcement of the bidding results, a single sales supply contract can be disclosed when signing a contract. event. This corresponds to . compared to the total number of issued shares, and the issuance price of warrants is KRW. Neurosil Shinhan Financial Investment and Shinhan Capital will issue bonds with warrants worth a total of KRW 100 million. In the case, it was confirmed that the foreclosure of real estate was lifted due to the withdrawal of the creditors' technology credit guarantee fund. UI Energy Last month, Hyundai Heavy Industries was ordered to pay 100 million won in a lawsuit filed with the Ulsan District Court for the balance of goods. Orient Present loan repayment and debt repayment It was decided to sell the land and buildings in Daeso-myeon, Eumseong-gun, Chungcheongbuk-do for 100 million won. As a result of applying for a paid-in capital increase in Manchuria through the general public offering method of Kumsung Tech, the subscription rate of . was recorded. Racing model Jung Eun-joo Star pictorial Best exposure ever, Mong-goo Jung, Kia, the sound of driving directly, Min Hyo-rin Shigu Jamsil-beol, still calm Lee Dae-ho Ho Homer Now, he is passionate about Lee Dae-po Bold upper body exposure in Scarlett Johansson's pictorial"
69,"Following is the news of major stocks after the close of the stock market. Announced that it has decided to issue a capital increase through a general public offering worth KRW billion won. Announced that it has decided to acquire a stake in Metro Education, a Dworks global academy company, for KRW 100 million. Hyosung ITX Hyundai Capital Announced that it had signed a contract with Hyundai Card for customer center business. It was announced that it had borrowed 100 million won from Golden Narae REITs general working capital. . The deadline for responses is 1 p.m. Sunday. An announcement was made that Choi Hyung-ki, CEO of Kumho Jong-Geum, Hwain Law Firm, and Cha Wang-jo, the current director of the Seoul Hope Forum, were respectively re-appointed and newly appointed as outside directors. Announced that it has decided to issue bonds with warrants worth KRW 100 million to KD Partners, Hyundai Corporate Finance Loan, KD Partners, Two Sun QM, etc. of Freetech Corporation. Aim Hi individual investor Park Jang-hyeong announced that he had bought and held 10,000 shares of Aim Hi global stock on the stock exchange. Announcing that it had filed a lawsuit claiming payment of a substantial license fee, etc. The Gemini Investment Korea Exchange responded that there was no important information to disclose separately to the request for disclosure related to the stock price surge. Announcing that it had decided to purchase a Hyundai Glovis car carrier for 100 million won. Tri-Circle billion won Announced that it had decided to issue a capital increase through a considerable general public offering method. Announced that the contract for the construction of the Yeongju-Sangju Expressway private investment project worth KRW 100 million was canceled. Announced that it has decided to acquire 10,000 won worth of treasury stocks. Announced that it has decided to guarantee 100 million won in debt of KC Cottrell's subsidiary. E-Daily Market Point, Korea's best financial information terminal for experts in the financial market E-Daily mobile service in the palm of your hand. Securities Expert Broadcasting E-Daily Customer Service Center | Stock Diagnosis Recommendation New Open Comprehensive Economic Information Media E-Daily Unauthorized reproduction and redistribution prohibited"
70,"Following is the news of major stocks after the close of the stock market. Announced that it has decided to issue a capital increase through a general public offering worth KRW billion won. Announced that it has decided to acquire a stake in Metro Education, a Dworks global academy company, for KRW 100 million. Hyosung ITX Hyundai Capital Announced that it had signed a contract with Hyundai Card for customer center business. It was announced that it had borrowed 100 million won from Golden Narae REITs general working capital. . The deadline for responses is 1 p.m. Sunday. An announcement was made that Choi Hyung-ki, CEO of Kumho Jong-Geum, Hwain Law Firm, and Cha Wang-jo, the current director of the Seoul Hope Forum, were respectively re-appointed and newly appointed as outside directors. Announced that it has decided to issue bonds with warrants worth KRW 100 million to KD Partners, Hyundai Corporate Finance Loan, KD Partners, Two Sun QM, etc. of Freetech Corporation. Aim Hi individual investor Park Jang-hyeong announced that he had bought and held 10,000 shares of Aim Hi global stock on the stock exchange. Announcing that it had filed a lawsuit claiming payment of a substantial license fee, etc. The Gemini Investment Korea Exchange responded that there was no important information to disclose separately to the request for disclosure related to the stock price surge. Announcing that it had decided to purchase a Hyundai Glovis car carrier for 100 million won. Tri-Circle billion won Announced that it had decided to issue a capital increase through a considerable general public offering method. Announced that the contract for the construction of the Yeongju-Sangju Expressway private investment project worth KRW 100 million was canceled. Announced that it has decided to acquire 10,000 won worth of treasury stocks. Announced that it has decided to guarantee 100 million won in debt of KC Cottrell's subsidiary. E-Daily Market Point, Korea's best financial information terminal for experts in the financial market E-Daily mobile service in the palm of your hand. Securities Expert Broadcasting E-Daily Customer Service Center | Stock Diagnosis Recommendation New Open Comprehensive Economic Information Media E-Daily Unauthorized reproduction and redistribution prohibited"
71,"Stock MarketSamsung Engineering Won a trillion-dollar power plant order in Kazakhstan Promoting conversion to a holding company Report unfounded Construction Won a trillion-won plant order in Saudi Arabia Won a billion-won radar component supply contract with Firstek Nex1 Daelim Industrial $ billion worth of Jubail synthetic rubber plant construction project in Saudi Arabia Received successful bid notice Daewoo Shipbuilding & Marine Engineering Mandoil held a corporate briefing session for global institutional investors at the Grand Hyatt Hotel in Seoul Signed a KRW 100 million information technology outsourcing service contract with Ildow Technology Kiwoom Securities Unselected as the preferred bidder for the acquisition of Lotte Shopping Hi-Mart Samsung Electronics Samsung Donation of KRW 100 million to the Welfare Foundation Acquired the entire stake in SHIF Korea, an overseas sub-subsidiary, Disposal of Hanssem treasury stock in Manchuria Cheil Industries held a company briefing session for domestic and foreign institutional investors Shinil Construction reduced short-term borrowings by KRW 100 million Ilkosdaq Market Mobile Leader Ministry of Knowledge Economy Industry Convergence Selected as the main organization for the original technology development project Woolim Machinery’s 100 million won steelmaking facility supply contract with POSCO No reason for the sharp rise in Shine Geum Steel’s stock price Acquisition of patents related to Infovine online identification Acquisition of patents related to CrucialTec user authentication Remote control related patents Investing in new facilities worth DNFP Acquisition of Omni System’s card manufacturing division for KRW 100,000 KRW SD System Signed a KRW billion integrated control center construction contract with Taean-gun, Chungcheongnam-do Signed KRW billion Hantan River flood control dam relocation road construction contract with Korea SE Daelim Won-Young Kim, a non-registered member of IDS, was granted the option to purchase stocks of 10,000 shares of common stock Tri-Circle Common shares Decide on a general public offering for 10,000 shares Expected issuance price Won Il-Gembexkael Korea Stem Cell Bank Disposal of stocks in Manchuria Resuming daily trading because it is not subject to disposal Disposal of 10,000 shares of Nepes and Nepes. Changed the largest shareholder from AMotion Koh Hyun-seok and others to Kwon Hyun-jin and others. With the Korea Institute of Technology Evaluation and Management in relation to the development of the original technology for the multi-core fusion processor, which is an AD Chips graphic processing device. The shocking secret of the exceptionally cheap pork belly on the date of signing the contract The sale was too big at the end of the tenure To utilize the performance of the monster phone Galaxy, the shocking confession of my daughter when she was in college At that time, even the request for bombers to destroy Korea"
72,"Change of company name to Pharmicell on the basis of new share allocation Doosan Infracore Wooridul Life Sciences Barunson KCP Gemback skael EMtech Thousands of toads Haunting earthquake Premonition Martian lingerie woman walking on the street wearing only lingerie Shocking appearance of Roh Moo-hyun outside the stage Unpublished photo essays Published Mong-Jun Chung registered as a presidential candidate. When I looked at the approval rating, a Martian male transit woman changes her boyfriend every week The absurd Herald News Herald Economics . Unauthorized reproduction and redistribution prohibited"
73,"Monthly Economic Schedule, Labor Day Closed Month Industrial Production US Monthly Personal Income US Monthly Personal Consumption Additional Listed Mortgage Mortgage Gyeongnam Enterprise New Intech Samsung Pharmaceutical Avaco Erit Basic Hynix S-Connect Pan Ocean Orion Texel Network Change Listing NCB Networks Hb Technology New Listed Mortgage Shareholders' Meeting Stem Science SKB Mulsan Seongyongkwang Electric Investment Co., Ltd. Monthly economic schedule Months closed on Labor Day Months Exported Months Imported months Trade balance is closed on Labor Day Months Manufacturing additional listing Networks Doosan Infracore Barunson Wooridul Life Sciences Gembackscar LKC Feed Change listing Life & Bit Tricircle Monthly Economic Schedule US Month Total Vehicle Sales US Month Employment Changes Finance Minister Meeting Month Daily Economic Schedule Day Constitution Day Closed Interest Rate Announcement US Weekly New Unemployment Claim US Month Non-Manufacturing Business Month Economic Schedule Day Green Day Closed Euro Month Retail Sales US Month Non-agricultural Sector Employment US Month Unemployment Rate New Commercial Equipment Artron Shareholders' Meeting Hwapoong Group Holding Company Green Non-Life Insurance Hyundai Securities Economic Indicators are based on Korean time. E-Daily Market Point, Korea's best financial information terminal for experts in the financial market E-Daily mobile service in the palm of your hand. Korea's best securities expert broadcasting E-Daily Customer Service Center Comprehensive economic information media E-Daily Unauthorized reproduction and redistribution prohibited"
74,"Change Listing Networks Technology Delisting Bokwang TS B&B Sungwon Ains Polyplus Change Listing Life&B Tri-Circle Free Rights Relax TV Logic Min Ye-Hong Weight Loss Hyeon-Hwa Kwak The Number of Times Dash From Male Celebrities Bin Laden Killed A Dizzying Moment Obama Couldn't Watch the Video for a Minute Jessica Alba Visited Korea The first place I visited on the first day was the doctors who turned their backs on Ahn Cheol-soo as colleagues, a habit that leads to success."
75,다음은 일 장 마감 후 나온 주요 공시다. 유가증권시장포스코는 프랑스 사 인수 검토 보도에 대한 거래소 조회공시 요구에 국내 조선 업계에서 프랑스 사 인수 참여를 요청할 경우 검토할 계획이었으나 매각 측 사정으로 매각 일정이 지연되고 있고 현재까지 국내 조선 업계로부터 요청을 받은 적이 없다며 현재 프랑스 사 인수 참여 여부에 대해 검토하고 있지 않다고 설명.는 결손 보전을 통한 재무 구조를 개선하기 위해 보통주 만주를 감자하기로 결정했다고 일 공시. 감자비율은 .웅진씽크빅은 일 보통주 만주를 장내 매수했다고 공시. 이로써 웅진씽크빅의 지분율은 .에서 .로 증가.외환은행은 분기 매출액과 영업이익이 지난해 같은 기간보다 각각 .와 . 감소한 조억만원 억만원을 기록했다고 공시. 당기순이익은 . 감소한 억만원으로 집계.하나금융지주는 분기 매출액이 지난해 같은 기간보다 . 늘어난 조억원을 기록했다고 일 공시. 영업이익과 당기순이익은 각각 와  감소한 억만원 억만원으로 집계.하나금융지주는 자회사인 하나은행의 분기 매출액과 영업이익이 지난해 같은 기간보다 각각 .와 . 감소한 조억만원 억만원을 기록했다고 일 공시. 당기순이익은 . 감소한 억만원으로 집계.대한유화는 폴리에스터 섬유의 기초원료인 에틸렌 옥사이드에틸렌 글리콜 사업에 진출하기 위해 억원 규모의 생산 시설을 온산 공장 내에 신설한다고 일 공시.상사는 분기 매출액이 지난해 같은 기간보다 . 감소한 조억만원을 기록했다고 일 공시. 영업이익은 . 증가한 억만원 당기순이익은 . 감소한 억만원으로 집계.솔로몬저축은행은 부실을 최소화하기 위해 자사주 만주를 처분하기로 결정했다고 일 공시. 처분 기간은 일부터 일까지임. 회사 측은 장내 처분으로 전량 매각하지 못할 경우 장외 처분을 할 수도 있다고 말함.대교는 보통주와 우선주 주당 각각 원의 현금배당을 결정했다고 일 공시. 시가 배당율은 보통주가 . 우선주가 ..대한생명은 생명 아시아태평양법인 인수 추진 보도에 대한 거래소의 조회공시 요구에 지난 일 생명 아시아법인 일부 인수를 위해 입찰 제안서를 제출하였다고 답변.하나투어는 분기 매출액과 영업이익이 지난해 같은 기간보다 각각 .와 . 증가한 억만원 억만원을 기록했다고 일 공시. 당기순이익은 . 증가한 억만원으로 집계.현대중공업은 재무 건전성을 높이기 위해 현대차 주식 만주를 처분하기로 결정했다고 일 공시.한국저축은행은 최대주주인 씨앤씨캐피탈이 보통주 만주를 장내매도했다고 일 공시. 씨앤씨캐피탈의 지분은 .에서 .로 감소. 코스닥시장엘티에스는 신주인수권의 행사가액을 원에서 원으로 조정했다고 일 공시. 조정 사유는 시가 하락에 의한 행사가액 조정.디에이피는 임직원의 성과급을 지급하기 위해 자사주 만주를 장외 처분하기로 결정했다고 일 공시. 처분 기간은 일부터 월 일까지.레드로버는 일 무상증자에 대한 권리락을 실시한다고 일 공시. 기준가는 주당 원.네오피델리티는 운전 자금을 마련하기 위해 금융기관으로부터 억원을 차입하기로 결정했다고 일 공시.한국거래소 코스닥시장본부는 디케이디앤아이에 위지트로의 피인수설 사실 여부와 구체적인 내용에 대한 조회 공시를 요구. 답변 시한은 일 오전 시까지.한국거래소 코스닥시장본부는 위지트에 디케이디앤아이 인수설의 사실 여부와 구체적인 내용에 대한 조회 공시를 요구.비츠로셀은 기관 투자자들을 대상으로 주식을 매도해 유통 주식수를 확대하고 주식 매매를 활성화하기 위해 보통주 만주를 장내 처분하기로 결정했다고 일 공시.컴투스는 자사주 주를 장외처분하기로 결정했다고 일 공시. 처분 목적은 주식매수 선택권 행사에 따른 자기 주식 교부.아큐텍은 기타 자금을 마련하기 위해 보통주 만주를 제 자 배정 증자하기로 결정했다고 일 공시. 신주 발행가액은 원이고 납입일은 월 일이다. 신주권 상장 예정일은 월 일.아이디엔은 타법인 증권 취득 자금을 마련하기 위해 억원 규모의 신주인수권부사채를 사모 방식으로 발행하기로 결정했다고 일 공시. 만기이자율은 .이고 행사가액은 주당 원. 사채만기일은 년 월 일.신라에스지는 부산 공장에 화재가 발생해 건물 기계장치 재고자산 등에 피해를 입었다고 일 공시. 회사 측은 화재 발생 경위와 피해 금액은 보험 회사 등과 협조해 조사 중에 있다고 말함. 더불어 신라에스지 측은 소시지 생산에 일정 기간동안 차질이 있을 것이라며 이에 따른 생산 대책으로 외주임가공을 검토 중에 있다고 말함.원익은 계열사인 국제전자센터빌딩 제차유한회사의 재무 구조를 개선하기 위해 이 회사 주식 만주를 취득하기로 결정했다고 일 공시.어울림엘시스는 서울중앙지방법원으로부터 신현성 정범태씨가 제기한 임시주주총회 효력중지 가처분신청이 접수됐다고 일 공시. 회사 측은 향후 법적 절차에 따라 대응할 예정이라고 밝힘.현대아이비티는 현지 판매 법인에 대한 장기 미회수 매출 채권을 자본금으로 출자 전환해 외화 환산 손익에 따른 환위험을 헤지하고 자회사의 재무 건전성을 확보하기 위해 계열사 현대아메리카의 주식 만주를 취득하기로 결정했다고 일 공시.디케이디앤아이는 최근 현저한 주가 급락과 위지트로의 피인수설에 대한 거래소 조회공시 요구에 최대 주주가 인수 합병 관련 제안을 받고 검토 중에 있으나 현재까지 구체적으로 확정된 사항은 없고 위지트로의 피인수설은 사실이 아니다라고 말함.위지트는 디케이디앤아이 인수설에 대한 거래소 조회공시에 사실이 아니다라고 일 답변.한국거래소 코스닥시장본부는 공급 계약 금액의  이상이 변경돼 트라이써클을 불성실 공시법인으로 지정 예고한다고 일 공시. 불성실 공시법인 지정 여부 결정시한은 월 일.조선비즈 핫 뉴스 멀미 나서 뉴 쏘렌토 불편한 진실엔씨소프트 결국 임원 주식처분 발동동 이건 비밀인데 절벽에 내몰린 자영업자들리쌍도 억 가로수길 빌딩 매입 이유있네금호 형제 불편한 재회분간 한마디도 안해.
76,"Month Ilright Rilak Pharmicell New Listed Mortgage Name Change NCB Networks Hb Technology Additional Listing Hynix Gyeongnam Enterprise Samsung Pharmaceutical Pan Ocean Orion Erit Basic New Intexel Netcom S-Connect Avaco Wall Ilshin Share Allocation Date Pharmicell Company Name Change Life & Bitrice Circle Addition Listing Doosan Infracore Wooridul Life Sciences Barunson KCP Gembaekskaelwol Work Rights Relax TV Logic Bundang Seon Spoken Korail When I heard the situation explanation, I heard the Queen of Exposure Ganlulu overwhelms the racing girls with the extravagant costumes. Why did CEO Lee Jeong-hee disappear? Where did he go? Just because he was pretty. Unauthorized reproduction and redistribution prohibited"
