,Unnamed: 0,기업,기사발행일,기사제목,뉴스기사본문전처리,기사본문번역
37,182,에스제이케이,2021.01.30. 오전 8:31,"[경매브리핑]파산한 에스제이케이 오산 공장, 169억에 팔려",지지옥션 월 마지막주 법원경매 동향 분석수원 디지털엠파이어 경쟁율 대  지난해 말 코스닥 상장사 가운데선 최초로 파산 선고를 받고 상장폐지된 에스제이케이의 오산 건물이 법원 경매에서 감정가보다 낮은 가격에 팔렸다.일 지지옥션의 주간 법원 경매 동향을 보면 경기 오산 가장동에 위치한 이 회사의 공장은 억만원에 낙찰돼 월 마지막주 최고 낙찰가 기록을 썼다. 감정가와 비교하면  수준이다.년 월 준공된 층 규모의 공장동 및 창고 식당 기숙사 기계실 등이 일괄 경매에 부쳐졌다. 가장일반산업단지에 인접해 있고 산업로에 바로 접해 있어 차량 접근성도 용이하다. 기존 소유 법인인 에스제이케이는 자동차 부품 및 전자부품을 제조했으나 경영난을 겪다 지난해 월엔 파산에 이르렀다.지지옥션 관계자는 대형 물건임에도 불구하고 입지 조건과 관리상태 등이 매우 양호해 회차 입찰에 감정가의  수준에 대원물산이 낙찰을 받았다고 전했다.법원 경매에 부쳐진 에스제이케이 오산 공장이번주 최다 응찰자 수 물건은 수원시 영통구 신동 소재 아파트형공장이다. 총 명이 응찰에 참여해 감정가의 .인 억만원에 낙찰됐다.년 월 준공된 디지털엠파이어 내 평 남짓한 개별 호실로 총 층 중 층에 위치해 있다. 수인분당선 망포역 번 출구에서 도보 분 거리에 인접해 있고 망포역 삼거리와 가까워 차량 접근성도 쾌적한 편이다. 물건 인근에 삼성전자 수원사업장을 비롯해 산업시설이 다수 밀집해 있어 아파트형공장 수요 또한 풍부한 편이다.지지옥션 관계자는 일반적으로 국가산업단지 내에 위치한 지식산업센터의 경우 임대가 불가하고 소유자만 영업 행위를 할 수 있지만 본 건의 경우 임대도 가능하다는 점이 많은 응찰자를 끌어 모았다고 분석했다.이번주 법원 경매는 총 건이 진행돼 이 중 건이 낙찰됐다. 낙찰가율은 . 총 낙찰가는 억원이다. 수도권 주거시설은 건이 경매에 부쳐져 이 가운데 건이 낙찰돼 낙찰률은 . 낙찰가율은 .를 기록했다. 서울 아파트는 건이 경매에 부쳐져 이중 건이 낙찰됐고 낙찰가율은 .다.김미영  시간 빠른 미리보는 뉴스 + 네이버에서 이데일리 뉴스를 만나보세요 빡침해소 청춘뉘우스 스냅타임종합 경제정보 미디어 이데일리  무단전재  재배포 금지,"Analysis of court auction trends in the last week of the month of Jiji Auction: Suwon Digital Empire Competition Rate vs. Osan building of SK Corp., which was declared bankrupt and delisted at the end of last year, was sold at a court auction at a lower price than the appraised price.According to Ilji Auction's weekly court auction trend, the company's factory in Gajang-dong, Osan, Gyeonggi Province, was sold for billions of won, setting a record for the highest winning bid in the last week of the month. It is comparable to the appraised value.The floor-sized factory building, warehouse, restaurant, dormitory, and machine room, which were completed in the month of last year, were auctioned off. It is adjacent to the most general industrial complex and is directly adjacent to the industrial road, making it easy to access vehicles. SJK, an existing owned corporation, manufactured auto parts and electronic parts, but went bankrupt last month after suffering from financial difficulties.An official from Jiji Auction said, ""Despite the large-scale product, Daewon C&T received a bid at the level of the appraised price due to its good location conditions and management condition.""The largest number of bidders for the SK Osan plant, which was auctioned by the court, is an apartment-type factory in Sindong, Yeongtong-gu, Suwon. The total number of people participated in the bidding and was sold for an appraised value of .1 billion won.It is located on the middle floor of the entire floor as a flat individual room in the Digital Empire, which was completed in January. It is adjacent to the Mangpo Station exit of the Suinbundang Line and is close to the Mangpo Station Intersection, so the accessibility of vehicles is also pleasant. Demand for apartment-type factories is also abundant as many industrial facilities, including Samsung Electronics' Suwon plant, are concentrated near the goods.An official from Jiji Auction said, ""In general, the knowledge industry center located in the national industrial complex cannot be rented and only the owner can conduct business activities, but in this case, it attracted many bidders.""This week's court auction was carried out in a total of cases, of which were won. The winning bid rate is... the total winning bid is 100 million won. Residential facilities in the Seoul metropolitan area were auctioned off, and among them, the winning bid rate was . Seoul apartments were auctioned off, with double bids and the winning bid rate is .Kim Miyoung Time Quick Preview News + E-Daily News on NAVER Young People's Snap Time Comprehensive Economic Information Media E-Daily Prohibition of Unauthorized Redistribution of Unauthorized Redistribution"
38,184,에스제이케이,2021.03.16. 오후 6:33,"에스제이케이, 서울회생법원에 회생절차 개시 신청", 에스제이케이는 지난 일 나종욱 대표이사 등이 서울회생법원에 회생절차 개시를 신청했다고 일 공시했다.회사 측은 현재 파산선고를 받아 파산 진행중이며 추후 회생절차 개시 여부 등이 결정되거나 변동사항이 발생할 경우 향후 공시하겠다고 설명했다.권효중  시간 빠른 미리보는 뉴스 + 네이버에서 이데일리 뉴스를 만나보세요 빡침해소 청춘뉘우스 스냅타임종합 경제정보 미디어 이데일리  무단전재  재배포 금지,SJK made a public announcement on the last day that CEO Na Jong-wook and others have applied for the commencement of rehabilitation procedures at the Seoul Rehabilitation Court.The company explained that it is currently under bankruptcy after being declared bankrupt and will disclose it in the future if it decides whether to start rehabilitation procedures or changes occur in the future.KWON HYOJUNG Time Fast Preview News + E-Daily News on NAVER Young People's Snap Time Comprehensive Economic Information Media E-Daily Prohibition of Unauthorized Redistribution of Unauthorized Redistribution
39,186,에스제이케이,2021.02.25. 오전 11:37,"에스제이케이, 케릭스바이오에 마스크 공급 계약 철회", 에스제이케이는 지난해 월 일 케릭스바이오와 일반 중 부직포 덴탈형 마스크 공급계약을 체결했고 이를 공시했으나 전날 해당 계약이 무효화됐다고 일 공시했다.회사 측은 당사가 마스크공급 계약을 하기 전인 년 월 일에 채권자에 의해 당사에 대한 파산선고 청구가 있었고 이후 년 월 일에 파산선고를 받게 되어 회사의 정상적인 운영이 불가해 공급계약의 진행에도 막대한 차질이 발생했다며 이에 당사는 파산선고에 대한 즉시 항고제기 및 기업회생을 준비하고 있는 바에 케릭스바이오 측과 합의를 통해 공급기간 및 계약조건을 변경하고자 했으나 파산법인의 계약의 변경은 법원의 승인이 있어야 함에 부득이하게 공급계약을 철회했다고 설명했다.고준혁  시간 빠른 미리보는 뉴스 + 네이버에서 이데일리 뉴스를 만나보세요 빡침해소 청춘뉘우스 스냅타임종합 경제정보 미디어 이데일리  무단전재  재배포 금지,"SJK signed a contract with Kerix Bio to supply general nonwoven dental masks on last month, and announced it, but announced that the contract was invalidated the previous day.The company explained that the company was declared bankrupt by its creditors on the year before the mask supply contract, and the company was declared bankrupt on the year after that, and the company was preparing to file an appeal and revive the company, but the contract had to be changed by the court.Go Junhyuk Time Quick Preview News + E-Daily News on NAVER Young People's Snap Time Comprehensive Economic Information Media E-Daily Prohibition of Unauthorized Redistribution of Unauthorized Redistribution"
40,188,에스제이케이,2020.12.02. 오후 7:23,‘코스닥 최초 상장 중 파산’ 에스제이케이 “즉각 항고”, 에스제이케이는 서울회생법원의 파산선고에 불복해 원 결정을 취소해달라는 취지의 항고장을 제출했다고 일 공시했다. 앞서 에스제이케이는 지난달 일 코스닥 상장사 중 처음으로 상장 상태에서 법원의 파산 결정을 받았다.조용석  시간 빠른 미리보는 뉴스 + 네이버에서 이데일리 뉴스를 만나보세요 빡침해소 청춘뉘우스 스냅타임종합 경제정보 미디어 이데일리  무단전재  재배포 금지,"SJK made a public announcement that it has filed an appeal to the effect of canceling the original decision against the Seoul Rehabilitation Court's declaration of bankruptcy. Earlier on last month, SJK was the first KOSDAQ-listed company to be declared bankrupt by the court while listed.Cho Yong Seok Time Fast Preview News + E-Daily News on NAVER Young People's Snap Time Comprehensive Economic Information Media E-Daily Prohibition of Unauthorized Redistribution of Unauthorized Redistribution"
41,195,에스제이케이,2020.12.24. 오전 3:59,"1兆 마스크 공급계약, 결국은 허위공시였나", 조원에 육박하는 마스크 공급계약을 내고 최근 주가가 급등했던 코스닥 상장사가 일주일만에 해당 계약을 철회했다. 계약 상대방으로 알려진 회사가 계약을 체결한 적 없다고 밝히면서 허위공시 의혹이 걷잡을 수 없이 커지자 계약 자체를 철회한 것으로 보인다.한국거래소 코스닥시장본부는 일 저녁 시분에 공시번복을 이유로 엘아이에스를 불성실공시법인으로 지정예고했다. 엘아이에스는 지난 일 낸 억원 규모의 공급계약을 이날 철회했다.레이저 장비 등 디스플레이 제조장비를 주로 만드는 코스닥 상장사 엘아이에스는 지난 일 억원 규모의  마스크를 태국 제지업체 더블에이그룹에 공급하는 계약을 체결했다고 공시했다. 공시 전 원선이던 주가는 만원까지 치솟았다. 억원이라는 계약금액에 주가가 뛰었던 것이다.그러다 이날 오전 시분 전일 대비 . 빠진 원에 머문 상태로 주식거래가 정지됐다. 마스크 이슈로 인한 상승분을 모두 반납하고 경고를 받은 셈이다.더블에이가 지난 일 한국지사 홈페이지를 통해 더블에이 더블에이 상표 및 더블에이케어 상표의 모든 제품을 포함한 당사 계열사는 해당 공시 기사와 관련이 없다며 한국의 어떤 회사와도 마스크 공급계약을 하지 않았음을 알린다고 밝혔기 때문이다.더블에이그룹은 년 설립된 태국의 제지업체로 더블라는 브랜드의 복사용지 인쇄용지 업체로 유명하다. 현재 한국을 비롯한 여개국에 더블에이 제품을 공급하는 태국을 대표하는 다국적 기업 중 한 곳이다.이날 저녁 시분이 돼서야 엘아이에스는 이날이 계약금 예정일이었으나 미입금됐다며 이번 계약의 중개업체 관계자 등과 연락이 안돼 진위파악이 되지 않고 있어 공급계약을 철회한다고 공시했다.엘아이에스의 억원 공시 전날부터 주가는 상한가로 치솟았고 이 때문에 공시내용의 사전정보 유출 가능성 등에 대한 의혹이 제기됐다. 공시가 나온 이후에도 엘아이에스의 해당 계약이 진짜인지에 대한 의혹이 역시 네이버 종목토론방 등에서 회자됐다.년 엘아이에스가 설립된 후 올해까지 만 년의 대부분을 레이저 장비 업무에 집중해왔기 때문이다. 올 월 임시주주총회에서 특수직물 제조업 등을 정관상 사업목적에 추가하며 마스크업을 개시하기는 했지만 올 분기 말까지 마스크 사업 관련 매출은 전무하다.오비이락 격일 수 있지만 엘아이에스처럼 마스크 사업 관련 공시를 내고 논란이 제기된 종목들은 종종 눈에 띈다. 화장품 제조 등을 주업으로 하는 코스닥 상장사 스킨앤스킨은 올 월 이피플러스라는 회사에 억원 규모의 선급금을 지급키로 했다는 공시를 낸 바 있다. 덴탈마스크의 국내외 유통사업을 통해 영업이익을 창출하겠다는 게 회사 측이 밝힌 선급금 지급 이유였다.더블에이코리아 홈페이지 캡쳐알고 보니 스킨앤스킨은 억원대 사모펀드 환매중단 사태를 일으킨 옵티머스자산운용 측과 연루됐다는 혐의를 받는 회사였고 스킨앤스킨의 거래 상대방이었던 이피플러스 역시 옵티머스 연루회사라는 공통점이 있었다. 스킨앤스킨은 경영진 횡령배임 의혹 등이 잇따라 불거지며 현재 거래정지 상태로 상장폐지 심의를 받고 있다.년 코스닥시장 개설 이후 상장된 상태로 파산선고를 받은 호 기업인 에스제이케이도 올 월 억원 규모의 덴탈 마스크 공급계약 체결사실을 공시했다. 금액 자체는 커보이지 않았지만 전년도 에스제이케이 전체 매출의 .배 규모였다. 에스제이케이는 파산을 이유로 상장폐지 결정이 내려졌으나 불복소송 절차를 밟고 있다.물론 모든 마스크 관련 계약을 의심할 필요는 없다. 실제 상당 수 기업들이 우수 기술을 바탕으로 마스크 관련 사업을 잘 하고 있다는 평가를 받고 있기 때문이다.예를 들어 톱텍의 경우 디스플레이 등 설비업을 비롯해 나노멤브레인 등에 대한 원천기술을 기반으로 이미 생리대 등 여성용품 시장에서 자리를 잡았다. 톱텍은 올해 월 조달청에 마스크 및 보조물품을 공급한 바 있다.역시 지난 월 조달청과 공급계약을 맺은 케이엠은 원래 정관상 주사업에 의료용품이나 장갑 등 제조업이 있는 데다 올 분기까지 누적 매출 억원 중 에 이르는 억원이 마스크에서 발생했다. 마스크가 주력인 회사였던 것이다황국상 기자 ..부동산 투자는 조 변호사의 가정상담소줄리아 투자노트저작권자  돈이 보이는 리얼타임 뉴스 머니투데이 무단전재 및 재배포 금지,"KOSDAQ-listed companies, which recently soared in stock prices after signing a mask supply contract close to trillion won, withdrew the contract in a week. The company, known as the other party to the contract, said it had never signed a contract, and apparently withdrew the contract itself as allegations of false disclosure grew out of control.The KOSDAQ Market Headquarters of the Korea Exchange announced the designation of LS as an unfaithful disclosure corporation, citing the reversal of the disclosure at the time of the evening. L.I.S. withdrew its supply contract worth 100 million won on the same day.L.I.S., a KOSDAQ-listed company that mainly makes display manufacturing equipment such as laser equipment, announced that it has signed a contract to supply masks worth 100 million won to Thai paper manufacturer Double A Group. The stock price, which was the original price before the announcement, soared to 10,000 won. The stock price jumped for the contract amount of 100 million won.Then, compared to the day before the morning of the day, stock trading was suspended with the missing. In other words, they returned all the gains caused by the mask issue and received a warning.This is because DoubleA announced on its website on the last day that its affiliates, including all products of DoubleA and DoubleA Care brands, are not related to the disclosure article and have not signed a mask supply contract with any Korean company.Double A Group is a Thai paper company established in the year and is famous for its copy paper printing company called Double. Currently, it is one of Thailand's leading multinational companies that supply Double A products to Korea and other countries.It was not until the evening that LS announced that it would withdraw the supply contract because it was not able to contact the broker's officials of the contract, saying that the deposit was scheduled but was not made.Stock prices have soared to the upper limit since the day before the disclosure of LI S's billion won, raising suspicions about the possibility of leakage of prior information on the disclosure. Even after the announcement was made, suspicions about whether the contract of LS was real were also talked about in Naver's stock discussion room.This is because most of the 10,000 years since LS was established until this year have been focused on laser equipment work. Although the mask business started at an extraordinary shareholders' meeting this month by adding special textile manufacturing to the business purpose according to the articles of association, there is no sales related to the mask business by the end of this quarter.It may be an over-rack, but stocks that have been controversial after making public announcements related to the mask business, such as LS, are often noticeable. Skin & Skin, a KOSDAQ-listed company that mainly manufactures cosmetics, announced this month that it will pay a prepayment of 100 million won to a company called EP Plus. The reason for the advance payment announced by the company was that it would generate operating profits through the domestic and foreign distribution business of Dental Mask.Capture of Double A Korea's website revealed that Skin & Skin was a company suspected of being involved with Optimus Asset Management, which caused the suspension of redemption of private equity funds worth 100 million won, and E+, which was Skin & Skin's counterpart, also had something in common. Skin & Skin is currently under review for delisting due to suspension of transactions due to a series of allegations of embezzlement and breach of trust by management.SJK, a good company that has been declared bankrupt since the opening of the KOSDAQ market this year, also announced that it signed a KRW 100 million dental mask supply contract this month. The amount itself did not seem large, but it was . times the size of SK's total sales in the previous year. SJK has been decided to delist due to bankruptcy, but it is in the process of filing an appeal.Of course, there is no need to doubt all mask-related contracts. In fact, many companies are evaluated to be doing well in mask-related business based on excellent technology.For example, Top Tech has already established itself in the market for women's products such as sanitary pads based on original technologies for nanomembrains and other facilities such as displays. Top Tech supplied masks and supplements to the monthly procurement agency this year.KM, which also signed a supply contract with the Public Procurement Service last month, originally had a manufacturing industry such as medical supplies and gloves in its main business, and the mask generated 100 million won out of accumulated sales until this quarter. It was a company that focused on masksReporter Hwang Kook-sang...Real estate investment is prohibited in real-time news money today without permission and redistribution of real-time news money where the copyright holder's money is visible"
